### ISSUE TITLE
Any advice for getting this running on Digital Ocean?

### ISSUE THREAD

**Issue by tkellen** [cloudnativelabs/kube-router#252]
I can't get cross-node pod-to-pod communication running. I'm pretty sure this is a digital ocean issue and not a kube-router one but I figured I'd ask here anyway to see if you have any insight.

Here's how I'm debugging:

```
root@digitalocean-node-0:/etc/cni/net.d# ip route
default via 165.227.80.1 dev eth0 onlink
10.10.0.0/16 dev eth0  proto kernel  scope link  src 10.10.0.6
10.20.0.0/24 dev kube-bridge  proto kernel  scope link  src 10.20.0.1
10.20.1.0/24 via 10.136.79.24 dev eth1  proto 17
10.136.0.0/16 dev eth1  proto kernel  scope link  src 10.136.77.249
165.227.80.0/20 dev eth0  proto kernel  scope link  src 165.227.85.248
```

```
root@digitalocean-node-1:~# ip route
default via 165.227.192.1 dev eth0 onlink
10.10.0.0/16 dev eth0  proto kernel  scope link  src 10.10.0.8
10.20.0.0/24 via 10.136.77.249 dev eth1  proto 17
10.136.0.0/16 dev eth1  proto kernel  scope link  src 10.136.79.24
165.227.192.0/20 dev eth0  proto kernel  scope link  src 165.227.192.203
```

```
❯ k get pods -o wide
NAME      READY     STATUS    RESTARTS   AGE       IP          NODE
test      1/1       Running   0          1m        10.20.1.3   digitalocean-node-1
test2     1/1       Running   0          57s       10.20.0.4   digitalocean-node-0
```

pinging from inside `test` pod on digitalocean-node-1
```
/ # ip addr show eth0
3: eth0@if8: <BROADCAST,MULTICAST,UP,LOWER_UP,M-DOWN> mtu 1500 qdisc noqueue
    link/ether 0a:58:0a:14:01:03 brd ff:ff:ff:ff:ff:ff
    inet 10.20.1.3/24 scope global eth0
       valid_lft forever preferred_lft forever
    inet6 fe80::9800:2cff:fecc:8001/64 scope link
       valid_lft forever preferred_lft forever
/ # ping 10.20.0.4
PING 10.20.0.4 (10.20.0.4): 56 data bytes
```

Traffic passes through kube-bridge into eth1 on the node the pod above resides in:
```
root@digitalocean-node-1:~# tcpdump -i eth1 icmp
tcpdump: verbose output suppressed, use -v or -vv for full protocol decode
listening on eth1, link-type EN10MB (Ethernet), capture size 262144 bytes
15:00:27.956938 IP 10.20.1.3 > 10.20.0.4: ICMP echo request, id 2048, seq 36, length 64
15:00:28.957145 IP 10.20.1.3 > 10.20.0.4: ICMP echo request, id 2048, seq 37, length 64
15:00:29.957326 IP 10.20.1.3 > 10.20.0.4: ICMP echo request, id 2048, seq 38, length 64
15:00:30.957451 IP 10.20.1.3 > 10.20.0.4: ICMP echo request, id 2048, seq 39, length 64
```

...nothing arrives at eth1 on the node it is destined for:
```
root@digitalocean-node-0:/etc/cni/net.d# tcpdump -i eth1 icmp
tcpdump: verbose output suppressed, use -v or -vv for full protocol decode
listening on eth1, link-type EN10MB (Ethernet), capture size 262144 bytes
```

I think DO might do some anti-spoofing at the hypervisor level. Assuming this is the case... is kube-router not a candidate without something like a VPN, or is there some additional configuration possible I'm not aware of?

Thanks so much if you can help, and thanks for kube-router!

**Comment by murali-reddy** [comment]
@tkellen If droplets are in different subnets, Kube-router uses IP-IP tunneling. IPIP tunneling packets are filtered on DO https://github.com/poseidon/typhoon/issues/11 But in above case both droplets are seems in same subnet.

I agree with your observation that DO might be doing  anti-spoofing. I am not very familiar with DO, but in AWS case there is sourc-destination check that has to be tunred off. I assume something similar must be available.

**Comment by tkellen** [comment]
@murali-reddy I got a response from DO on this, which you can see here:
https://github.com/tkellen/kwm/tree/master/hack/digitalocean

They do not have a src/dest check setting (yet).

**Comment by murali-reddy** [comment]
>Our network does uses some security features to block traffic with a source address that doesn't match the Droplet sending the traffic. 

That explains it. Unfortunatley Kube-Router uses direct routing without overlays.

**Comment by tkellen** [comment]
I chose kube-router precisely to avoid overlay networks. No big deal, they just aren't a hosting candidate for me until this is fixed. Thanks for the confirmation @murali-reddy. I'll follow up if I hear back from them that this has been resolved.
