### ISSUE TITLE
IPv6 NDP NA/NS dropped when using egress network policy

### ISSUE THREAD

**Issue by QlemWasTaken** [cloudnativelabs/kube-router#1895]
## What happened?

NDP NA/NS from pods to kube-bridge interface are dropped when an egress NetworkPolicy are applied to the pod. As a result, the pod cannot resolve the mac adresse of the gateway, and kube-router cannot forward any packet to the pod because it cannot resolve the pod mac address.

## What did you expect to happen?

NDP NA/NS should not be dropped

## How can we reproduce the behavior you experienced?

Create a pod with an egress network policy which deny traffic expect to some specific pods.
This is a test, ipv6 only cluster. Each pod get their own public IPv6 address. (nota: public ipv6 addresses have been redacted)
I'm trying to achieve a simple setup where I deny any egress from a pod except to coredns.

Everything works fine without egress policy. (see Logs at the ends)

## Screenshots / Architecture Diagrams / Network Topologies
Pods manifest 
```yaml
apiVersion: v1
kind: Pod
metadata:
  name: nettoolsbis
  namespace: default
  labels:
    app: testbis
spec:
  containers:
  - name: nettoolsbis
    image: docker.io/nicolaka/netshoot
    command: ["/bin/bash"]
    args: ["-c", "while true; do ping localhost; sleep 60;done"]
    securityContext:
      privileged: false
      allowPrivilegeEscalation: false
      capabilities:
        drop:
          - ALL
      runAsNonRoot: true
      runAsUser: 1000
      seccompProfile:
        type: RuntimeDefault
```
Network Policy :
```yaml
apiVersion: networking.k8s.io/v1
kind: NetworkPolicy
metadata:
  name: nettoolsbis-egress-policy
  namespace: default
spec:
  podSelector:
    matchLabels:
      app: testbis
  policyTypes:
    - Egress
  egress:
    - to:
      - namespaceSelector:
          matchLabels:
            kubernetes.io/metadata.name: kube-system
        podSelector:
          matchLabels:
            k8s-app: kube-dns
```
coredns services clusterIP is `fd00:60::a`

```
	+--------------------------------------+       +------------------------------------------+ 
	| Node talos-worker130 / kube-router   |       | Node talos-controlplane120 / kube-router | 
	| 2a0e:db8:db8:7560:1::1/80            |       | 2a0e:db8:db8:7560::1/80                  | 
	|                                      |       |                                          | 
	| +---------------------------------+  |       | +---------------------------------+      | 
	| | Default namespace               |  |       | | kube-system namespace           |      | 
	| | +-----------------------------+ |  |       | | +-----------------------------+ |      | 
	| | | nettools pod                | |  |       | | | coredns pod                 | |      | 
	| | | 2a0e:db8:db8:7560:1::5/80   | |  |       | | | 2a0e:db8:db8:7560::3/80     | |      | 
	| | |                             | |  |       | | |                             | |      | 
	| | +-----------------------------+ |  |       | | +-----------------------------+ |      | 
	| +---------------------------------+  |       | +---------------------------------+      | 
	+--------------------------------------+       +------------------------------------------+                                                                                                                           
```

## System Information (please complete the following information)

- Kube-Router Version (`kube-router --version`): `2.5.0`
- Kube-Router Parameters: [e.g. --run-router --run-service-proxy --enable-overlay --overlay-type=full etc.]
```
        - "--run-router=true"
        - "--run-firewall=true" # needed for kubernetes network policies
        - "--run-service-proxy=true"
        - "--enable-ipv4=true"
        - "--enable-ipv6=true"
        - "--enable-pod-egress=false"
        - "--enable-overlay=false"
        - "--bgp-graceful-restart=true"
        - "--kubeconfig=/var/lib/kube-router/kubeconfig"
        - "--enable-ibgp=true"
        - "--cluster-asn=64575"
        - "--router-id=generate"
        - "--advertise-pod-cidr=true"
        - "--advertise-external-ip=true"
        - "--service-external-ip-range=fdac:60::/64"
```
- Kubernetes Version (`kubectl version`) : [e.g. 1.18.3]
```
Client Version: v1.32.2
Kustomize Version: v5.5.0
Server Version: v1.32.0
```
- Cloud Type: [e.g. AWS, GCP, Azure, on premise]
On premise
- Kubernetes Deployment Type: [e.g. EKS, GKE, Kops, Kubeadm, etc.]
This is a 3 nodes Talos kubernetes clusters provisionned with opentofu in Proxmox virtual machines.
- Kube-Router Deployment Type: [e.g. DaemonSet, System Service]
```yaml
kind: DaemonSet
```
- Cluster Size: [e.g. 200 Nodes]
3 nodes, 2 workers, 1 controlplane

## Description of the problems and logs
Request from pod :
```
nettoolsbis:/root$  dig google.com +tries=2
;; communications error to fd00:60::a#53: host unreachable
;; communications error to fd00:60::a#53: host unreachable

; <<>> DiG 9.20.10 <<>> google.com +tries=2
;; global options: +cmd
;; no servers could be reached
```

The pod cannot resolve the gateway :
```
nettoolsbis:/root$ ip -6 nei show
2a0e:db8:db8:7560:1::1 dev eth0 FAILED
```

tcmdump on the kube-router pod (worker130 node) :
```
root@talos-worker130:~ #tcpdump -n -i any "(udp port 53) or (icmp6)"
tcpdump: WARNING: any: That device doesn't support promiscuous mode
(Promiscuous mode not supported on the "any" device)
tcpdump: verbose output suppressed, use -v[v]... for full protocol decode
listening on any, link-type LINUX_SLL2 (Linux cooked v2), snapshot length 262144 bytes
# The node does not answer to the neighbor solicitation from the pod
17:16:44.350682 veth60cc35ba M   IP6 2a0e:db8:db8:7560:1::5 > ff02::1:ff00:1: ICMP6, neighbor solicitation, who has 2a0e:db8:db8:7560:1::1, length 32
17:16:44.350682 kube-bridge M   IP6 2a0e:db8:db8:7560:1::5 > ff02::1:ff00:1: ICMP6, neighbor solicitation, who has 2a0e:db8:db8:7560:1::1, length 32
17:16:45.373307 veth60cc35ba M   IP6 2a0e:db8:db8:7560:1::5 > ff02::1:ff00:1: ICMP6, neighbor solicitation, who has 2a0e:db8:db8:7560:1::1, length 32
17:16:45.373307 kube-bridge M   IP6 2a0e:db8:db8:7560:1::5 > ff02::1:ff00:1: ICMP6, neighbor solicitation, who has 2a0e:db8:db8:7560:1::1, length 32
17:16:46.397233 veth60cc35ba M   IP6 2a0e:db8:db8:7560:1::5 > ff02::1:ff00:1: ICMP6, neighbor solicitation, who has 2a0e:db8:db8:7560:1::1, length 32
17:16:46.397233 kube-bridge M   IP6 2a0e:db8:db8:7560:1::5 > ff02::1:ff00:1: ICMP6, neighbor solicitation, who has 2a0e:db8:db8:7560:1::1, length 32
17:16:47.421424 veth60cc35ba M   IP6 2a0e:db8:db8:7560:1::5 > ff02::1:ff00:1: ICMP6, neighbor solicitation, who has 2a0e:db8:db8:7560:1::1, length 32
17:16:47.421424 kube-bridge M   IP6 2a0e:db8:db8:7560:1::5 > ff02::1:ff00:1: ICMP6, neighbor solicitation, who has 2a0e:db8:db8:7560:1::1, length 32
17:16:48.445306 veth60cc35ba M   IP6 2a0e:db8:db8:7560:1::5 > ff02::1:ff00:1: ICMP6, neighbor solicitation, who has 2a0e:db8:db8:7560:1::1, length 32
17:16:48.445306 kube-bridge M   IP6 2a0e:db8:db8:7560:1::5 > ff02::1:ff00:1: ICMP6, neighbor solicitation, who has 2a0e:db8:db8:7560:1::1, length 32
17:16:49.469240 veth60cc35ba M   IP6 2a0e:db8:db8:7560:1::5 > ff02::1:ff00:1: ICMP6, neighbor solicitation, who has 2a0e:db8:db8:7560:1::1, length 32
17:16:49.469240 kube-bridge M   IP6 2a0e:db8:db8:7560:1::5 > ff02::1:ff00:1: ICMP6, neighbor solicitation, who has 2a0e:db8:db8:7560:1::1, length 32
```

I attached the ip6tables after (which I zeroed just before trying a request).
NDP packets seems to be dropped around here :
```
[...]

Chain KUBE-NWPLCY-DEFAULT (1 references)
 pkts bytes target     prot opt in     out     source               destination
    0     0 ACCEPT     ipv6-icmp --  any    any     anywhere             anywhere             /* allow icmp echo requests */ ipv6-icmp echo-request
    0     0 ACCEPT     ipv6-icmp --  any    any     anywhere             anywhere             /* allow icmp destination unreachable messages */ ipv6-icmp destination-unreachable
    0     0 ACCEPT     ipv6-icmp --  any    any     anywhere             anywhere             /* allow icmp time exceeded messages */ ipv6-icmp time-exceeded
    0     0 ACCEPT     ipv6-icmp --  any    any     anywhere             anywhere             /* allow icmp neighbor solicitation messages */ ipv6-icmp neighbour-solicitation
    0     0 ACCEPT     ipv6-icmp --  any    any     anywhere             anywhere             /* allow icmp neighbor advertisement messages */ ipv6-icmp neighbour-advertisement
    0     0 ACCEPT     ipv6-icmp --  any    any     anywhere             anywhere             /* allow icmp echo reply messages */ ipv6-icmp echo-reply
    0     0 MARK       all  --  any    any     anywhere             anywhere             /* rule to mark traffic matching a network policy */ MARK or 0x10000

[...]

Chain KUBE-POD-FW-PXQ5TJJPMTTKOCX7 (7 references)
 pkts bytes target     prot opt in     out     source               destination
    2   294 ACCEPT     all  --  any    any     anywhere             anywhere             /* rule for stateful firewall for pod */ ctstate RELATED,ESTABLISHED
    6   720 DROP       all  --  any    any     anywhere             anywhere             /* rule to drop invalid state for pod */ ctstate INVALID
    0     0 ACCEPT     all  --  any    any     anywhere             2a0e:db8:db8:7560:1::5  /* rule to permit the traffic traffic to pods when source is the pod's local node */ ADDRTYPE match src-type LOCAL
    0     0 KUBE-NWPLCY-DEFAULT  all  --  any    any     anywhere             2a0e:db8:db8:7560:1::5  /* run through default ingress network policy chain */
    8   630 KUBE-NWPLCY-F2AVPWKVSOR3F2VF  all  --  any    any     2a0e:db8:db8:7560:1::5  anywhere             /* run through nw policy nettoolsbis-egress-policy */
    8   630 NFLOG      all  --  any    any     anywhere             anywhere             /* rule to log dropped traffic POD name:nettoolsbis namespace: default */ mark match ! 0x10000/0x10000 limit: avg 10/min burst 10 nflog-group 100
    8   630 REJECT     all  --  any    any     anywhere             anywhere             /* rule to REJECT traffic destined for POD name:nettoolsbis namespace: default */ mark match ! 0x10000/0x10000 reject-with icmp6-port-unreachable
    0     0 MARK       all  --  any    any     anywhere             anywhere             MARK and 0xfffeffff
    0     0 MARK       all  --  any    any     anywhere             anywhere             /* set mark to ACCEPT traffic that comply to network policies */ MARK or 0x20000
```
NDP Packet do not pass through the KUBE-NWPLCY-DEFAULT chain because NDP NS is destinated to `ff02::1:ff00:0/104` and NDP NA are destinated to the requester address : answer from the node should pass but answer from the pod to the node address (gateway) won't.

As a workaround, I tried to allow egress to all pods in the `kube-system` namespace (kube-router is in the `kube-system` namespace), but it changes nothings. I also tried to allow egress to cidr `ff02::1:ff00:0/104` without anymore success.

### Complte ip6tables logs 
```
root@talos-worker130:~ #ip6tables -vL -t filter -Z
# Warning: ip6tables-legacy tables present, use ip6tables-legacy to see them
Chain INPUT (policy ACCEPT 989 packets, 122K bytes)
 pkts bytes target     prot opt in     out     source               destination
  997  122K KUBE-ROUTER-INPUT  all  --  any    any     anywhere             anywhere             /* kube-router netpol - 4IA2OSFRMVNDXBVV */
    0     0 KUBE-ROUTER-SERVICES  all  --  any    any     anywhere             anywhere             /* handle traffic to IPVS service IPs in custom chain */ match-set inet6:kube-router-svip dst

Chain FORWARD (policy ACCEPT 0 packets, 0 bytes)
 pkts bytes target     prot opt in     out     source               destination
    1    72 KUBE-ROUTER-FORWARD  all  --  any    any     anywhere             anywhere             /* kube-router netpol - TEMCG2JMHZYE7H7T */
    0     0 ACCEPT     all  --  any    eth1    anywhere             anywhere             /* allow outbound node port traffic on node interface with which node ip is associated */
    1    72 ACCEPT     all  --  any    kube-bridge  anywhere             anywhere             /* allow inbound traffic to pods */
    0     0 ACCEPT     all  --  kube-bridge any     anywhere             anywhere             /* allow outbound traffic from pods */

Chain OUTPUT (policy ACCEPT 883 packets, 106K bytes)
 pkts bytes target     prot opt in     out     source               destination
  892  107K KUBE-ROUTER-OUTPUT  all  --  any    any     anywhere             anywhere             /* kube-router netpol - VEAAIY32XVBHCSCY */

Chain KUBE-NWPLCY-AZV3K3SBEDRWGOIW (1 references)
 pkts bytes target     prot opt in     out     source               destination

Chain KUBE-NWPLCY-DEFAULT (1 references)
 pkts bytes target     prot opt in     out     source               destination
    0     0 ACCEPT     ipv6-icmp --  any    any     anywhere             anywhere             /* allow icmp echo requests */ ipv6-icmp echo-request
    0     0 ACCEPT     ipv6-icmp --  any    any     anywhere             anywhere             /* allow icmp destination unreachable messages */ ipv6-icmp destination-unreachable
    0     0 ACCEPT     ipv6-icmp --  any    any     anywhere             anywhere             /* allow icmp time exceeded messages */ ipv6-icmp time-exceeded
    0     0 ACCEPT     ipv6-icmp --  any    any     anywhere             anywhere             /* allow icmp neighbor solicitation messages */ ipv6-icmp neighbour-solicitation
    0     0 ACCEPT     ipv6-icmp --  any    any     anywhere             anywhere             /* allow icmp neighbor advertisement messages */ ipv6-icmp neighbour-advertisement
    0     0 ACCEPT     ipv6-icmp --  any    any     anywhere             anywhere             /* allow icmp echo reply messages */ ipv6-icmp echo-reply
    0     0 MARK       all  --  any    any     anywhere             anywhere             /* rule to mark traffic matching a network policy */ MARK or 0x10000

Chain KUBE-NWPLCY-F2AVPWKVSOR3F2VF (1 references)
 pkts bytes target     prot opt in     out     source               destination
    0     0 MARK       all  --  any    any     anywhere             anywhere             /* rule to ACCEPT traffic from source pods to dest pods selected by policy name nettoolsbis-egress-policy namespace default */ match-set inet6:KUBE-SRC-KICODQRYWVRBJ6VT src match-set inet6:KUBE-DST-K3EZICREUZBOS2GJ dst MARK or 0x10000
    0     0 RETURN     all  --  any    any     anywhere             anywhere             /* rule to ACCEPT traffic from source pods to dest pods selected by policy name nettoolsbis-egress-policy namespace default */ match-set inet6:KUBE-SRC-KICODQRYWVRBJ6VT src match-set inet6:KUBE-DST-K3EZICREUZBOS2GJ dst mark match 0x10000/0x10000

Chain KUBE-NWPLCY-S4YIDAYHZF5H4MQQ (0 references)
 pkts bytes target     prot opt in     out     source               destination
    0     0 MARK       all  --  any    any     anywhere             anywhere             /* rule to ACCEPT traffic from source pods to dest pods selected by policy name nettools-egress-policy namespace kube-system */ match-set inet6:KUBE-SRC-YZ6ESQTTUBCV7XQJ src match-set inet6:KUBE-DST-WE7KZX7T3Q4AMQ6W dst MARK or 0x10000
    0     0 RETURN     all  --  any    any     anywhere             anywhere             /* rule to ACCEPT traffic from source pods to dest pods selected by policy name nettools-egress-policy namespace kube-system */ match-set inet6:KUBE-SRC-YZ6ESQTTUBCV7XQJ src match-set inet6:KUBE-DST-WE7KZX7T3Q4AMQ6W dst mark match 0x10000/0x10000

Chain KUBE-NWPLCY-ZAT5MBBAKCEHJW2E (1 references)
 pkts bytes target     prot opt in     out     source               destination
    0     0 MARK       tcp  --  any    any     anywhere             anywhere             /* rule to ACCEPT traffic from specified ipBlocks to dest pods selected by policy name: whoami-ingress-policy namespace whoami-ns */ match-set inet6:KUBE-SRC-7Y4YYVDWEAM56ITD src match-set inet6:KUBE-DST-4D5TOCIRCACR2LLB dst tcp dpt:http MARK or 0x10000
    0     0 RETURN     tcp  --  any    any     anywhere             anywhere             /* rule to ACCEPT traffic from specified ipBlocks to dest pods selected by policy name: whoami-ingress-policy namespace whoami-ns */ match-set inet6:KUBE-SRC-7Y4YYVDWEAM56ITD src match-set inet6:KUBE-DST-4D5TOCIRCACR2LLB dst tcp dpt:http mark match 0x10000/0x10000

Chain KUBE-POD-FW-NHG4NO2DDBHYAS3H (7 references)
 pkts bytes target     prot opt in     out     source               destination
    0     0 ACCEPT     all  --  any    any     anywhere             anywhere             /* rule for stateful firewall for pod */ ctstate RELATED,ESTABLISHED
    0     0 DROP       all  --  any    any     anywhere             anywhere             /* rule to drop invalid state for pod */ ctstate INVALID
    0     0 ACCEPT     all  --  any    any     anywhere             2a0e:db8:db8:7560:1::3  /* rule to permit the traffic traffic to pods when source is the pod's local node */ ADDRTYPE match src-type LOCAL
    0     0 KUBE-NWPLCY-AZV3K3SBEDRWGOIW  all  --  any    any     2a0e:db8:db8:7560:1::3  anywhere             /* run through nw policy whoami-egress-policy */
    0     0 KUBE-NWPLCY-ZAT5MBBAKCEHJW2E  all  --  any    any     anywhere             2a0e:db8:db8:7560:1::3  /* run through nw policy whoami-ingress-policy */
    0     0 NFLOG      all  --  any    any     anywhere             anywhere             /* rule to log dropped traffic POD name:whoami-dep-59ff678d49-7wjdh namespace: whoami-ns */ mark match ! 0x10000/0x10000 limit: avg 10/min burst 10 nflog-group 100
    0     0 REJECT     all  --  any    any     anywhere             anywhere             /* rule to REJECT traffic destined for POD name:whoami-dep-59ff678d49-7wjdh namespace: whoami-ns */ mark match ! 0x10000/0x10000 reject-with icmp6-port-unreachable
    0     0 MARK       all  --  any    any     anywhere             anywhere             MARK and 0xfffeffff
    0     0 MARK       all  --  any    any     anywhere             anywhere             /* set mark to ACCEPT traffic that comply to network policies */ MARK or 0x20000

Chain KUBE-POD-FW-PXQ5TJJPMTTKOCX7 (7 references)
 pkts bytes target     prot opt in     out     source               destination
    2   294 ACCEPT     all  --  any    any     anywhere             anywhere             /* rule for stateful firewall for pod */ ctstate RELATED,ESTABLISHED
    6   720 DROP       all  --  any    any     anywhere             anywhere             /* rule to drop invalid state for pod */ ctstate INVALID
    0     0 ACCEPT     all  --  any    any     anywhere             2a0e:db8:db8:7560:1::5  /* rule to permit the traffic traffic to pods when source is the pod's local node */ ADDRTYPE match src-type LOCAL
    0     0 KUBE-NWPLCY-DEFAULT  all  --  any    any     anywhere             2a0e:db8:db8:7560:1::5  /* run through default ingress network policy chain */
    8   630 KUBE-NWPLCY-F2AVPWKVSOR3F2VF  all  --  any    any     2a0e:db8:db8:7560:1::5  anywhere             /* run through nw policy nettoolsbis-egress-policy */
    8   630 NFLOG      all  --  any    any     anywhere             anywhere             /* rule to log dropped traffic POD name:nettoolsbis namespace: default */ mark match ! 0x10000/0x10000 limit: avg 10/min burst 10 nflog-group 100
    8   630 REJECT     all  --  any    any     anywhere             anywhere             /* rule to REJECT traffic destined for POD name:nettoolsbis namespace: default */ mark match ! 0x10000/0x10000 reject-with icmp6-port-unreachable
    0     0 MARK       all  --  any    any     anywhere             anywhere             MARK and 0xfffeffff
    0     0 MARK       all  --  any    any     anywhere             anywhere             /* set mark to ACCEPT traffic that comply to network policies */ MARK or 0x20000

Chain KUBE-ROUTER-FORWARD (1 references)
 pkts bytes target     prot opt in     out     source               destination
    0     0 KUBE-POD-FW-PXQ5TJJPMTTKOCX7  all  --  any    any     anywhere             2a0e:db8:db8:7560:1::5  /* rule to jump traffic destined to POD name:nettoolsbis namespace: default to chain KUBE-POD-FW-PXQ5TJJPMTTKOCX7 */
    0     0 KUBE-POD-FW-PXQ5TJJPMTTKOCX7  all  --  any    any     anywhere             2a0e:db8:db8:7560:1::5  PHYSDEV match --physdev-is-bridged /* rule to jump traffic destined to POD name:nettoolsbis namespace: default to chain KUBE-POD-FW-PXQ5TJJPMTTKOCX7 */
    0     0 KUBE-POD-FW-PXQ5TJJPMTTKOCX7  all  --  any    any     2a0e:db8:db8:7560:1::5  anywhere             /* rule to jump traffic from POD name:nettoolsbis namespace: default to chain KUBE-POD-FW-PXQ5TJJPMTTKOCX7 */
    0     0 KUBE-POD-FW-PXQ5TJJPMTTKOCX7  all  --  any    any     2a0e:db8:db8:7560:1::5  anywhere             PHYSDEV match --physdev-is-bridged /* rule to jump traffic from POD name:nettoolsbis namespace: default to chain KUBE-POD-FW-PXQ5TJJPMTTKOCX7 */
    0     0 KUBE-POD-FW-NHG4NO2DDBHYAS3H  all  --  any    any     anywhere             2a0e:db8:db8:7560:1::3  /* rule to jump traffic destined to POD name:whoami-dep-59ff678d49-7wjdh namespace: whoami-ns to chain KUBE-POD-FW-NHG4NO2DDBHYAS3H */
    0     0 KUBE-POD-FW-NHG4NO2DDBHYAS3H  all  --  any    any     anywhere             2a0e:db8:db8:7560:1::3  PHYSDEV match --physdev-is-bridged /* rule to jump traffic destined to POD name:whoami-dep-59ff678d49-7wjdh namespace: whoami-ns to chain KUBE-POD-FW-NHG4NO2DDBHYAS3H */
    0     0 KUBE-POD-FW-NHG4NO2DDBHYAS3H  all  --  any    any     2a0e:db8:db8:7560:1::3  anywhere             /* rule to jump traffic from POD name:whoami-dep-59ff678d49-7wjdh namespace: whoami-ns to chain KUBE-POD-FW-NHG4NO2DDBHYAS3H */
    0     0 KUBE-POD-FW-NHG4NO2DDBHYAS3H  all  --  any    any     2a0e:db8:db8:7560:1::3  anywhere             PHYSDEV match --physdev-is-bridged /* rule to jump traffic from POD name:whoami-dep-59ff678d49-7wjdh namespace: whoami-ns to chain KUBE-POD-FW-NHG4NO2DDBHYAS3H */
    0     0 ACCEPT     all  --  any    any     anywhere             anywhere             /* rule to explicitly ACCEPT traffic that comply to network policies */ mark match 0x20000/0x20000

Chain KUBE-ROUTER-INPUT (1 references)
 pkts bytes target     prot opt in     out     source               destination
    0     0 RETURN     tcp  --  any    any     anywhere             anywhere             /* allow LOCAL TCP traffic to node ports - LR7XO7NXDBGQJD2M */ ADDRTYPE match dst-type LOCAL multiport dports 30000:32767
    0     0 RETURN     udp  --  any    any     anywhere             anywhere             /* allow LOCAL UDP traffic to node ports - 76UCBPIZNGJNWNUZ */ ADDRTYPE match dst-type LOCAL multiport dports 30000:32767
    0     0 RETURN     all  --  any    any     anywhere             fdac:60::/64         /* allow traffic to external IP range: fdac:60::/64 - OO2KS6I6A6Z6XCZE */
    8   630 KUBE-POD-FW-PXQ5TJJPMTTKOCX7  all  --  any    any     2a0e:db8:db8:7560:1::5  anywhere             /* rule to jump traffic from POD name:nettoolsbis namespace: default to chain KUBE-POD-FW-PXQ5TJJPMTTKOCX7 */
    0     0 KUBE-POD-FW-NHG4NO2DDBHYAS3H  all  --  any    any     2a0e:db8:db8:7560:1::3  anywhere             /* rule to jump traffic from POD name:whoami-dep-59ff678d49-7wjdh namespace: whoami-ns to chain KUBE-POD-FW-NHG4NO2DDBHYAS3H */
    0     0 ACCEPT     all  --  any    any     anywhere             anywhere             /* rule to explicitly ACCEPT traffic that comply to network policies */ mark match 0x20000/0x20000

Chain KUBE-ROUTER-OUTPUT (1 references)
 pkts bytes target     prot opt in     out     source               destination
    8  1014 KUBE-POD-FW-PXQ5TJJPMTTKOCX7  all  --  any    any     anywhere             2a0e:db8:db8:7560:1::5  /* rule to jump traffic destined to POD name:nettoolsbis namespace: default to chain KUBE-POD-FW-PXQ5TJJPMTTKOCX7 */
    0     0 KUBE-POD-FW-PXQ5TJJPMTTKOCX7  all  --  any    any     2a0e:db8:db8:7560:1::5  anywhere             /* rule to jump traffic from POD name:nettoolsbis namespace: default to chain KUBE-POD-FW-PXQ5TJJPMTTKOCX7 */
    0     0 KUBE-POD-FW-NHG4NO2DDBHYAS3H  all  --  any    any     anywhere             2a0e:db8:db8:7560:1::3  /* rule to jump traffic destined to POD name:whoami-dep-59ff678d49-7wjdh namespace: whoami-ns to chain KUBE-POD-FW-NHG4NO2DDBHYAS3H */
    0     0 KUBE-POD-FW-NHG4NO2DDBHYAS3H  all  --  any    any     2a0e:db8:db8:7560:1::3  anywhere             /* rule to jump traffic from POD name:whoami-dep-59ff678d49-7wjdh namespace: whoami-ns to chain KUBE-POD-FW-NHG4NO2DDBHYAS3H */
    0     0 ACCEPT     all  --  any    any     anywhere             anywhere             /* rule to explicitly ACCEPT traffic that comply to network policies */ mark match 0x20000/0x20000

Chain KUBE-ROUTER-SERVICES (1 references)
 pkts bytes target     prot opt in     out     source               destination
    0     0 ACCEPT     ipv6-icmp --  any    any     anywhere             anywhere             /* allow icmp echo requests */ ipv6-icmp echo-request
    0     0 ACCEPT     ipv6-icmp --  any    any     anywhere             anywhere             /* allow icmp destination unreachable messages */ ipv6-icmp destination-unreachable
    0     0 ACCEPT     ipv6-icmp --  any    any     anywhere             anywhere             /* allow icmp time exceeded messages */ ipv6-icmp time-exceeded
    0     0 ACCEPT     ipv6-icmp --  any    any     anywhere             anywhere             /* allow icmp neighbor solicitation messages */ ipv6-icmp neighbour-solicitation
    0     0 ACCEPT     ipv6-icmp --  any    any     anywhere             anywhere             /* allow icmp neighbor advertisement messages */ ipv6-icmp neighbour-advertisement
    0     0 ACCEPT     ipv6-icmp --  any    any     anywhere             anywhere             /* allow icmp echo reply messages */ ipv6-icmp echo-reply
    0     0 ACCEPT     all  --  any    any     anywhere             anywhere             /* allow input traffic to ipvs services */ match-set inet6:kube-router-svip-prt dst,dst
    0     0 REJECT     all  --  any    any     anywhere             anywhere             /* reject all unexpected traffic to service IPs */ ! match-set inet6:kube-router-local-ips dst reject-with icmp6-port-unreachable
Zeroing chain `INPUT'
Zeroing chain `FORWARD'
Zeroing chain `OUTPUT'
Zeroing chain `KUBE-NWPLCY-AZV3K3SBEDRWGOIW'
Zeroing chain `KUBE-NWPLCY-DEFAULT'
Zeroing chain `KUBE-NWPLCY-F2AVPWKVSOR3F2VF'
Zeroing chain `KUBE-NWPLCY-S4YIDAYHZF5H4MQQ'
Zeroing chain `KUBE-NWPLCY-ZAT5MBBAKCEHJW2E'
Zeroing chain `KUBE-POD-FW-NHG4NO2DDBHYAS3H'
Zeroing chain `KUBE-POD-FW-PXQ5TJJPMTTKOCX7'
Zeroing chain `KUBE-ROUTER-FORWARD'
Zeroing chain `KUBE-ROUTER-INPUT'
Zeroing chain `KUBE-ROUTER-OUTPUT'
Zeroing chain `KUBE-ROUTER-SERVICES'

# After dns request try
root@talos-worker130:~ #ip6tables -vL -t filter
# Warning: ip6tables-legacy tables present, use ip6tables-legacy to see them
Chain INPUT (policy ACCEPT 135 packets, 13995 bytes)
 pkts bytes target     prot opt in     out     source               destination
  144 14697 KUBE-ROUTER-INPUT  all  --  any    any     anywhere             anywhere             /* kube-router netpol - 4IA2OSFRMVNDXBVV */
    0     0 KUBE-ROUTER-SERVICES  all  --  any    any     anywhere             anywhere             /* handle traffic to IPVS service IPs in custom chain */ match-set inet6:kube-router-svip dst

Chain FORWARD (policy ACCEPT 0 packets, 0 bytes)
 pkts bytes target     prot opt in     out     source               destination
    0     0 KUBE-ROUTER-FORWARD  all  --  any    any     anywhere             anywhere             /* kube-router netpol - TEMCG2JMHZYE7H7T */
    0     0 ACCEPT     all  --  any    eth1    anywhere             anywhere             /* allow outbound node port traffic on node interface with which node ip is associated */
    0     0 ACCEPT     all  --  any    kube-bridge  anywhere             anywhere             /* allow inbound traffic to pods */
    0     0 ACCEPT     all  --  kube-bridge any     anywhere             anywhere             /* allow outbound traffic from pods */

Chain OUTPUT (policy ACCEPT 143 packets, 17860 bytes)
 pkts bytes target     prot opt in     out     source               destination
  151 18874 KUBE-ROUTER-OUTPUT  all  --  any    any     anywhere             anywhere             /* kube-router netpol - VEAAIY32XVBHCSCY */

Chain KUBE-NWPLCY-AZV3K3SBEDRWGOIW (1 references)
 pkts bytes target     prot opt in     out     source               destination

Chain KUBE-NWPLCY-DEFAULT (1 references)
 pkts bytes target     prot opt in     out     source               destination
    0     0 ACCEPT     ipv6-icmp --  any    any     anywhere             anywhere             /* allow icmp echo requests */ ipv6-icmp echo-request
    0     0 ACCEPT     ipv6-icmp --  any    any     anywhere             anywhere             /* allow icmp destination unreachable messages */ ipv6-icmp destination-unreachable
    0     0 ACCEPT     ipv6-icmp --  any    any     anywhere             anywhere             /* allow icmp time exceeded messages */ ipv6-icmp time-exceeded
    0     0 ACCEPT     ipv6-icmp --  any    any     anywhere             anywhere             /* allow icmp neighbor solicitation messages */ ipv6-icmp neighbour-solicitation
    0     0 ACCEPT     ipv6-icmp --  any    any     anywhere             anywhere             /* allow icmp neighbor advertisement messages */ ipv6-icmp neighbour-advertisement
    0     0 ACCEPT     ipv6-icmp --  any    any     anywhere             anywhere             /* allow icmp echo reply messages */ ipv6-icmp echo-reply
    0     0 MARK       all  --  any    any     anywhere             anywhere             /* rule to mark traffic matching a network policy */ MARK or 0x10000

Chain KUBE-NWPLCY-F2AVPWKVSOR3F2VF (1 references)
 pkts bytes target     prot opt in     out     source               destination
    0     0 MARK       all  --  any    any     anywhere             anywhere             /* rule to ACCEPT traffic from source pods to dest pods selected by policy name nettoolsbis-egress-policy namespace default */ match-set inet6:KUBE-SRC-KICODQRYWVRBJ6VT src match-set inet6:KUBE-DST-K3EZICREUZBOS2GJ dst MARK or 0x10000
    0     0 RETURN     all  --  any    any     anywhere             anywhere             /* rule to ACCEPT traffic from source pods to dest pods selected by policy name nettoolsbis-egress-policy namespace default */ match-set inet6:KUBE-SRC-KICODQRYWVRBJ6VT src match-set inet6:KUBE-DST-K3EZICREUZBOS2GJ dst mark match 0x10000/0x10000

Chain KUBE-NWPLCY-S4YIDAYHZF5H4MQQ (0 references)
 pkts bytes target     prot opt in     out     source               destination
    0     0 MARK       all  --  any    any     anywhere             anywhere             /* rule to ACCEPT traffic from source pods to dest pods selected by policy name nettools-egress-policy namespace kube-system */ match-set inet6:KUBE-SRC-YZ6ESQTTUBCV7XQJ src match-set inet6:KUBE-DST-WE7KZX7T3Q4AMQ6W dst MARK or 0x10000
    0     0 RETURN     all  --  any    any     anywhere             anywhere             /* rule to ACCEPT traffic from source pods to dest pods selected by policy name nettools-egress-policy namespace kube-system */ match-set inet6:KUBE-SRC-YZ6ESQTTUBCV7XQJ src match-set inet6:KUBE-DST-WE7KZX7T3Q4AMQ6W dst mark match 0x10000/0x10000

Chain KUBE-NWPLCY-ZAT5MBBAKCEHJW2E (1 references)
 pkts bytes target     prot opt in     out     source               destination
    0     0 MARK       tcp  --  any    any     anywhere             anywhere             /* rule to ACCEPT traffic from specified ipBlocks to dest pods selected by policy name: whoami-ingress-policy namespace whoami-ns */ match-set inet6:KUBE-SRC-7Y4YYVDWEAM56ITD src match-set inet6:KUBE-DST-4D5TOCIRCACR2LLB dst tcp dpt:http MARK or 0x10000
    0     0 RETURN     tcp  --  any    any     anywhere             anywhere             /* rule to ACCEPT traffic from specified ipBlocks to dest pods selected by policy name: whoami-ingress-policy namespace whoami-ns */ match-set inet6:KUBE-SRC-7Y4YYVDWEAM56ITD src match-set inet6:KUBE-DST-4D5TOCIRCACR2LLB dst tcp dpt:http mark match 0x10000/0x10000

Chain KUBE-POD-FW-NHG4NO2DDBHYAS3H (7 references)
 pkts bytes target     prot opt in     out     source               destination
    0     0 ACCEPT     all  --  any    any     anywhere             anywhere             /* rule for stateful firewall for pod */ ctstate RELATED,ESTABLISHED
    0     0 DROP       all  --  any    any     anywhere             anywhere             /* rule to drop invalid state for pod */ ctstate INVALID
    0     0 ACCEPT     all  --  any    any     anywhere             2a0e:db8:db8:7560:1::3  /* rule to permit the traffic traffic to pods when source is the pod's local node */ ADDRTYPE match src-type LOCAL
    0     0 KUBE-NWPLCY-AZV3K3SBEDRWGOIW  all  --  any    any     2a0e:db8:db8:7560:1::3  anywhere             /* run through nw policy whoami-egress-policy */
    0     0 KUBE-NWPLCY-ZAT5MBBAKCEHJW2E  all  --  any    any     anywhere             2a0e:db8:db8:7560:1::3  /* run through nw policy whoami-ingress-policy */
    0     0 NFLOG      all  --  any    any     anywhere             anywhere             /* rule to log dropped traffic POD name:whoami-dep-59ff678d49-7wjdh namespace: whoami-ns */ mark match ! 0x10000/0x10000 limit: avg 10/min burst 10 nflog-group 100
    0     0 REJECT     all  --  any    any     anywhere             anywhere             /* rule to REJECT traffic destined for POD name:whoami-dep-59ff678d49-7wjdh namespace: whoami-ns */ mark match ! 0x10000/0x10000 reject-with icmp6-port-unreachable
    0     0 MARK       all  --  any    any     anywhere             anywhere             MARK and 0xfffeffff
    0     0 MARK       all  --  any    any     anywhere             anywhere             /* set mark to ACCEPT traffic that comply to network policies */ MARK or 0x20000

Chain KUBE-POD-FW-PXQ5TJJPMTTKOCX7 (7 references)
 pkts bytes target     prot opt in     out     source               destination
    2   294 ACCEPT     all  --  any    any     anywhere             anywhere             /* rule for stateful firewall for pod */ ctstate RELATED,ESTABLISHED
    6   720 DROP       all  --  any    any     anywhere             anywhere             /* rule to drop invalid state for pod */ ctstate INVALID
    0     0 ACCEPT     all  --  any    any     anywhere             2a0e:db8:db8:7560:1::5  /* rule to permit the traffic traffic to pods when source is the pod's local node */ ADDRTYPE match src-type LOCAL
    0     0 KUBE-NWPLCY-DEFAULT  all  --  any    any     anywhere             2a0e:db8:db8:7560:1::5  /* run through default ingress network policy chain */
    8   630 KUBE-NWPLCY-F2AVPWKVSOR3F2VF  all  --  any    any     2a0e:db8:db8:7560:1::5  anywhere             /* run through nw policy nettoolsbis-egress-policy */
    8   630 NFLOG      all  --  any    any     anywhere             anywhere             /* rule to log dropped traffic POD name:nettoolsbis namespace: default */ mark match ! 0x10000/0x10000 limit: avg 10/min burst 10 nflog-group 100
    8   630 REJECT     all  --  any    any     anywhere             anywhere             /* rule to REJECT traffic destined for POD name:nettoolsbis namespace: default */ mark match ! 0x10000/0x10000 reject-with icmp6-port-unreachable
    0     0 MARK       all  --  any    any     anywhere             anywhere             MARK and 0xfffeffff
    0     0 MARK       all  --  any    any     anywhere             anywhere             /* set mark to ACCEPT traffic that comply to network policies */ MARK or 0x20000

Chain KUBE-ROUTER-FORWARD (1 references)
 pkts bytes target     prot opt in     out     source               destination
    0     0 KUBE-POD-FW-PXQ5TJJPMTTKOCX7  all  --  any    any     anywhere             2a0e:db8:db8:7560:1::5  /* rule to jump traffic destined to POD name:nettoolsbis namespace: default to chain KUBE-POD-FW-PXQ5TJJPMTTKOCX7 */
    0     0 KUBE-POD-FW-PXQ5TJJPMTTKOCX7  all  --  any    any     anywhere             2a0e:db8:db8:7560:1::5  PHYSDEV match --physdev-is-bridged /* rule to jump traffic destined to POD name:nettoolsbis namespace: default to chain KUBE-POD-FW-PXQ5TJJPMTTKOCX7 */
    0     0 KUBE-POD-FW-PXQ5TJJPMTTKOCX7  all  --  any    any     2a0e:db8:db8:7560:1::5  anywhere             /* rule to jump traffic from POD name:nettoolsbis namespace: default to chain KUBE-POD-FW-PXQ5TJJPMTTKOCX7 */
    0     0 KUBE-POD-FW-PXQ5TJJPMTTKOCX7  all  --  any    any     2a0e:db8:db8:7560:1::5  anywhere             PHYSDEV match --physdev-is-bridged /* rule to jump traffic from POD name:nettoolsbis namespace: default to chain KUBE-POD-FW-PXQ5TJJPMTTKOCX7 */
    0     0 KUBE-POD-FW-NHG4NO2DDBHYAS3H  all  --  any    any     anywhere             2a0e:db8:db8:7560:1::3  /* rule to jump traffic destined to POD name:whoami-dep-59ff678d49-7wjdh namespace: whoami-ns to chain KUBE-POD-FW-NHG4NO2DDBHYAS3H */
    0     0 KUBE-POD-FW-NHG4NO2DDBHYAS3H  all  --  any    any     anywhere             2a0e:db8:db8:7560:1::3  PHYSDEV match --physdev-is-bridged /* rule to jump traffic destined to POD name:whoami-dep-59ff678d49-7wjdh namespace: whoami-ns to chain KUBE-POD-FW-NHG4NO2DDBHYAS3H */
    0     0 KUBE-POD-FW-NHG4NO2DDBHYAS3H  all  --  any    any     2a0e:db8:db8:7560:1::3  anywhere             /* rule to jump traffic from POD name:whoami-dep-59ff678d49-7wjdh namespace: whoami-ns to chain KUBE-POD-FW-NHG4NO2DDBHYAS3H */
    0     0 KUBE-POD-FW-NHG4NO2DDBHYAS3H  all  --  any    any     2a0e:db8:db8:7560:1::3  anywhere             PHYSDEV match --physdev-is-bridged /* rule to jump traffic from POD name:whoami-dep-59ff678d49-7wjdh namespace: whoami-ns to chain KUBE-POD-FW-NHG4NO2DDBHYAS3H */
    0     0 ACCEPT     all  --  any    any     anywhere             anywhere             /* rule to explicitly ACCEPT traffic that comply to network policies */ mark match 0x20000/0x20000

Chain KUBE-ROUTER-INPUT (1 references)
 pkts bytes target     prot opt in     out     source               destination
    0     0 RETURN     tcp  --  any    any     anywhere             anywhere             /* allow LOCAL TCP traffic to node ports - LR7XO7NXDBGQJD2M */ ADDRTYPE match dst-type LOCAL multiport dports 30000:32767
    0     0 RETURN     udp  --  any    any     anywhere             anywhere             /* allow LOCAL UDP traffic to node ports - 76UCBPIZNGJNWNUZ */ ADDRTYPE match dst-type LOCAL multiport dports 30000:32767
    0     0 RETURN     all  --  any    any     anywhere             fdac:60::/64         /* allow traffic to external IP range: fdac:60::/64 - OO2KS6I6A6Z6XCZE */
    8   630 KUBE-POD-FW-PXQ5TJJPMTTKOCX7  all  --  any    any     2a0e:db8:db8:7560:1::5  anywhere             /* rule to jump traffic from POD name:nettoolsbis namespace: default to chain KUBE-POD-FW-PXQ5TJJPMTTKOCX7 */
    0     0 KUBE-POD-FW-NHG4NO2DDBHYAS3H  all  --  any    any     2a0e:db8:db8:7560:1::3  anywhere             /* rule to jump traffic from POD name:whoami-dep-59ff678d49-7wjdh namespace: whoami-ns to chain KUBE-POD-FW-NHG4NO2DDBHYAS3H */
    0     0 ACCEPT     all  --  any    any     anywhere             anywhere             /* rule to explicitly ACCEPT traffic that comply to network policies */ mark match 0x20000/0x20000

Chain KUBE-ROUTER-OUTPUT (1 references)
 pkts bytes target     prot opt in     out     source               destination
    8  1014 KUBE-POD-FW-PXQ5TJJPMTTKOCX7  all  --  any    any     anywhere             2a0e:db8:db8:7560:1::5  /* rule to jump traffic destined to POD name:nettoolsbis namespace: default to chain KUBE-POD-FW-PXQ5TJJPMTTKOCX7 */
    0     0 KUBE-POD-FW-PXQ5TJJPMTTKOCX7  all  --  any    any     2a0e:db8:db8:7560:1::5  anywhere             /* rule to jump traffic from POD name:nettoolsbis namespace: default to chain KUBE-POD-FW-PXQ5TJJPMTTKOCX7 */
    0     0 KUBE-POD-FW-NHG4NO2DDBHYAS3H  all  --  any    any     anywhere             2a0e:db8:db8:7560:1::3  /* rule to jump traffic destined to POD name:whoami-dep-59ff678d49-7wjdh namespace: whoami-ns to chain KUBE-POD-FW-NHG4NO2DDBHYAS3H */
    0     0 KUBE-POD-FW-NHG4NO2DDBHYAS3H  all  --  any    any     2a0e:db8:db8:7560:1::3  anywhere             /* rule to jump traffic from POD name:whoami-dep-59ff678d49-7wjdh namespace: whoami-ns to chain KUBE-POD-FW-NHG4NO2DDBHYAS3H */
    0     0 ACCEPT     all  --  any    any     anywhere             anywhere             /* rule to explicitly ACCEPT traffic that comply to network policies */ mark match 0x20000/0x20000

Chain KUBE-ROUTER-SERVICES (1 references)
 pkts bytes target     prot opt in     out     source               destination
    0     0 ACCEPT     ipv6-icmp --  any    any     anywhere             anywhere             /* allow icmp echo requests */ ipv6-icmp echo-request
    0     0 ACCEPT     ipv6-icmp --  any    any     anywhere             anywhere             /* allow icmp destination unreachable messages */ ipv6-icmp destination-unreachable
    0     0 ACCEPT     ipv6-icmp --  any    any     anywhere             anywhere             /* allow icmp time exceeded messages */ ipv6-icmp time-exceeded
    0     0 ACCEPT     ipv6-icmp --  any    any     anywhere             anywhere             /* allow icmp neighbor solicitation messages */ ipv6-icmp neighbour-solicitation
    0     0 ACCEPT     ipv6-icmp --  any    any     anywhere             anywhere             /* allow icmp neighbor advertisement messages */ ipv6-icmp neighbour-advertisement
    0     0 ACCEPT     ipv6-icmp --  any    any     anywhere             anywhere             /* allow icmp echo reply messages */ ipv6-icmp echo-reply
    0     0 ACCEPT     all  --  any    any     anywhere             anywhere             /* allow input traffic to ipvs services */ match-set inet6:kube-router-svip-prt dst,dst
    0     0 REJECT     all  --  any    any     anywhere             anywhere             /* reject all unexpected traffic to service IPs */ ! match-set inet6:kube-router-local-ips dst reject-with icmp6-port-unreachable
```

### Addresses on node 
Addresses on kube-router pod (node worker130)
```
root@talos-worker130:~ #ip a
[...]
10: kube-bridge: <BROADCAST,MULTICAST,UP,LOWER_UP> mtu 1460 qdisc noqueue state UP group default qlen 1000
    link/ether da:2e:f3:fa:bd:b9 brd ff:ff:ff:ff:ff:ff
    inet 10.75.96.65/26 brd 10.75.96.127 scope global kube-bridge
       valid_lft forever preferred_lft forever
    inet6 2a0e:db8:db8:7560:1::1/80 scope global
       valid_lft forever preferred_lft forever
    inet6 fe80::d82e:f3ff:fefa:bdb9/64 scope link proto kernel_ll
       valid_lft forever preferred_lft forever
11: kube-dummy-if: <BROADCAST,NOARP,UP,LOWER_UP> mtu 1500 qdisc noqueue state UNKNOWN group default
    link/ether ea:d9:0c:0b:1e:f5 brd ff:ff:ff:ff:ff:ff
    inet6 fd00:60::a/128 scope global
       valid_lft forever preferred_lft forever
    inet6 fd00:60::1/128 scope global
       valid_lft forever preferred_lft forever
    inet6 fe80::e8d9:cff:fe0b:1ef5/64 scope link proto kernel_ll
       valid_lft forever preferred_lft forever
13: veth00b2db4c@if5: <BROADCAST,MULTICAST,UP,LOWER_UP> mtu 1460 qdisc noqueue master kube-bridge state UP group default qlen 1000
    link/ether 6e:bf:c8:6d:30:9a brd ff:ff:ff:ff:ff:ff link-netnsid 0
    inet6 fe80::6cbf:c8ff:fe6d:309a/64 scope link proto kernel_ll
       valid_lft forever preferred_lft forever
14: veth9b8ede5b@if5: <BROADCAST,MULTICAST,UP,LOWER_UP> mtu 1460 qdisc noqueue master kube-bridge state UP group default qlen 1000
    link/ether 26:7b:c1:c5:c6:c8 brd ff:ff:ff:ff:ff:ff link-netnsid 1
    inet6 fe80::247b:c1ff:fec5:c6c8/64 scope link proto kernel_ll
       valid_lft forever preferred_lft forever
15: veth60cc35ba@if5: <BROADCAST,MULTICAST,UP,LOWER_UP> mtu 1460 qdisc noqueue master kube-bridge state UP group default qlen 1000
    link/ether 7e:01:70:fe:27:99 brd ff:ff:ff:ff:ff:ff link-netnsid 1
    inet6 fe80::7c01:70ff:fefe:2799/64 scope link proto kernel_ll
       valid_lft forever preferred_lft forever
```

### Without egress policy, pod can reach dns
The test was made with the same manifest but without the policy, it has a different IP, mac, ...
Addresses on pod
```
nettoolsbis:/root$ ip a
1: lo: <LOOPBACK,UP,LOWER_UP> mtu 65536 qdisc noqueue state UNKNOWN group default qlen 1000
    link/loopback 00:00:00:00:00:00 brd 00:00:00:00:00:00
    inet 127.0.0.1/8 scope host lo
       valid_lft forever preferred_lft forever
    inet6 ::1/128 scope host proto kernel_lo
       valid_lft forever preferred_lft forever
2: tunl0@NONE: <NOARP> mtu 1480 qdisc noop state DOWN group default qlen 1000
    link/ipip 0.0.0.0 brd 0.0.0.0
3: sit0@NONE: <NOARP> mtu 1480 qdisc noop state DOWN group default qlen 1000
    link/sit 0.0.0.0 brd 0.0.0.0
4: ip6tnl0@NONE: <NOARP> mtu 1452 qdisc noop state DOWN group default qlen 1000
    link/tunnel6 :: brd :: permaddr fe2c:1ee:dffa::
5: eth0@if15: <BROADCAST,MULTICAST,UP,LOWER_UP> mtu 1460 qdisc noqueue state UP group default qlen 1000
    link/ether 5a:74:5c:c2:47:93 brd ff:ff:ff:ff:ff:ff link-netnsid 0
    inet 10.75.96.69/26 brd 10.75.96.127 scope global eth0
       valid_lft forever preferred_lft forever
    inet6 2a0e:db8:db8:7560:1::5/80 scope global
       valid_lft forever preferred_lft forever
    inet6 fe80::5874:5cff:fec2:4793/64 scope link proto kernel_ll
       valid_lft forever preferred_lft forever
```

Request to dns from pod :
```
nettoolsbis:/root$ dig google.com

; <<>> DiG 9.20.10 <<>> google.com
;; global options: +cmd
;; Got answer:
;; ->>HEADER<<- opcode: QUERY, status: NOERROR, id: 10555
;; flags: qr rd ra; QUERY: 1, ANSWER: 1, AUTHORITY: 0, ADDITIONAL: 1

;; OPT PSEUDOSECTION:
; EDNS: version: 0, flags:; udp: 1232
; COOKIE: 66d057d5ff280b02 (echoed)
;; QUESTION SECTION:
;google.com.                    IN      A

;; ANSWER SECTION:
google.com.             30      IN      A       142.250.74.238

;; Query time: 20 msec
;; SERVER: fd00:60::a#53(fd00:60::a) (UDP)
;; WHEN: Sun Aug 31 16:26:04 UTC 2025
;; MSG SIZE  rcvd: 77
```

tcpdump in the kube-router pod on worker130 node
```
root@talos-worker130:~ #tcpdump -n -i any "(udp port 53) or (icmp6)"
tcpdump: WARNING: any: That device doesn't support promiscuous mode
(Promiscuous mode not supported on the "any" device)
tcpdump: verbose output suppressed, use -v[v]... for full protocol decode
listening on any, link-type LINUX_SLL2 (Linux cooked v2), snapshot length 262144 bytes

# DNS request is forwarded to coredns endpoint
16:26:04.548681 veth9b8ede5b P   IP6 2a0e:db8:db8:7560:1::4.60727 > fd00:60::a.53: 10555+ [1au] A? google.com. (51)
16:26:04.548681 kube-bridge In  IP6 2a0e:db8:db8:7560:1::4.60727 > fd00:60::a.53: 10555+ [1au] A? google.com. (51)
16:26:04.548749 eth1  Out IP6 2a0e:db8:db8:7560:1::4.60727 > 2a0e:db8:db8:7560::3.53: 10555+ [1au] A? google.com. (51)

# DNS answer come on the node interface
16:26:04.565113 eth1  In  IP6 2a0e:db8:db8:7560::3.53 > 2a0e:db8:db8:7560:1::4.60727: 10555 1/0/1 A 142.250.74.238 (77)

# Node send an NDP neighbor solicitation
16:26:04.565147 kube-bridge Out IP6 fe80::d82e:f3ff:fefa:bdb9 > ff02::1:ff00:4: ICMP6, neighbor solicitation, who has 2a0e:db8:db8:7560:1::4, length 32
16:26:04.565162 veth9b8ede5b Out IP6 fe80::d82e:f3ff:fefa:bdb9 > ff02::1:ff00:4: ICMP6, neighbor solicitation, who has 2a0e:db8:db8:7560:1::4, length 32
16:26:04.565164 veth00b2db4c Out IP6 fe80::d82e:f3ff:fefa:bdb9 > ff02::1:ff00:4: ICMP6, neighbor solicitation, who has 2a0e:db8:db8:7560:1::4, length 32

# Pods answer with an NDP neighbor advertisement
16:26:04.565171 veth9b8ede5b P   IP6 2a0e:db8:db8:7560:1::4 > fe80::d82e:f3ff:fefa:bdb9: ICMP6, neighbor advertisement, tgt is 2a0e:db8:db8:7560:1::4, length 32
16:26:04.565171 kube-bridge In  IP6 2a0e:db8:db8:7560:1::4 > fe80::d82e:f3ff:fefa:bdb9: ICMP6, neighbor advertisement, tgt is 2a0e:db8:db8:7560:1::4, length 32

# DNS answer is forwarded to the pod
16:26:04.565185 kube-bridge Out IP6 fd00:60::a.53 > 2a0e:db8:db8:7560:1::4.60727: 10555 1/0/1 A 142.250.74.238 (77)
16:26:04.565186 veth9b8ede5b Out IP6 fd00:60::a.53 > 2a0e:db8:db8:7560:1::4.60727: 10555 1/0/1 A 142.250.74.238 (77)
```

**Comment by aauren** [comment]
@QlemWasTaken Thanks for the incredibly detailed bug report! It really makes it easy to see where things might be breaking down.

I'm working on a kube-router 2.6.0 release and if possible I'd like to get a fix in for this if I have time.

**Comment by aauren** [comment]
@QlemWasTaken - I believe that I've fixed this issue via #1913, at least it did in my reproduction. Can you test it out for me and let me know how it works for you?

If you run kube-router in a container, you should be able to pull the fixes in there via pointing the image for your kube-router deployment to: `cloudnativelabs/kube-router-git:PR-1913`
