### ISSUE TITLE
bad routing from host to service IP on same host

### ISSUE THREAD

**Issue by phemmer** [cloudnativelabs/kube-router#376]
Currently if you try to access a service IP from a host in which that IP is present, it will randomly fail.

For example:
```
# oc get svc -o wide
NAME         TYPE        CLUSTER-IP      EXTERNAL-IP   PORT(S)   AGE       SELECTOR
webconsole   ClusterIP   10.128.64.184   <none>        443/TCP   3m        webconsole=true

# oc get pods -l webconsole=true -o wide
NAME                          READY     STATUS    RESTARTS   AGE       IP           NODE
webconsole-7bb99b5c76-44pzs   1/1       Running   0          1h        10.128.0.3   node01
webconsole-7bb99b5c76-z9qhc   1/1       Running   0          1h        10.128.2.3   node02
```
From node01:
```
# psgrep kube-router -- h -o command
/usr/local/bin/kube-router --run-router=true --run-firewall=true --run-service-proxy=true --kubeconfig=/var/lib/kube-router/kubeconfig --bgp-graceful-restart=true --cluster-cidr=10.128.0.0/18 --cluster-asn=65101 --peer-router-ips=10.0.33.218 --peer-router-asns=65101 --peer-router-passwords= --enable-overlay=false --enable-pod-egress=false --advertise-cluster-ip=true --advertise-external-ip=true --advertise-loadbalancer-ip=true --hairpin-mode

# ip addr show | grep 10.128.64.184
    inet 10.128.64.184/32 brd 10.128.64.184 scope link kube-dummy-if

# ipvsadm -ln -t 10.128.64.184:443 
Prot LocalAddress:Port Scheduler Flags
  -> RemoteAddress:Port           Forward Weight ActiveConn InActConn
TCP  10.128.64.184:443 rr
  -> 10.128.0.3:8443              Masq    1      0          0         
  -> 10.128.2.3:8443              Masq    1      0          0         

# curl -k https://webconsole.openshift-web-console.svc/healthz
curl: (7) Failed connect to webconsole.openshift-web-console.svc:443; Connection timed out
```
At the same time from node02:
```
# tcpdump -nn -i ens192 'host 10.128.64.184'
19:03:19.637049 IP 10.128.64.184.44828 > 10.128.2.3.8443: Flags [S], seq 3022741939, win 43690, options [mss 65495,sackOK,TS val 12590808 ecr 0,nop,wscale 7], length 0
19:03:20.638708 IP 10.128.64.184.44828 > 10.128.2.3.8443: Flags [S], seq 3022741939, win 43690, options [mss 65495,sackOK,TS val 12591810 ecr 0,nop,wscale 7], length 0
19:03:22.644723 IP 10.128.64.184.44828 > 10.128.2.3.8443: Flags [S], seq 3022741939, win 43690, options [mss 65495,sackOK,TS val 12593816 ecr 0,nop,wscale 7], length 0

# journalctl -t kernel -n 30 | grep martian
Apr 09 19:03:19 node02 kernel: IPv4: martian source 10.128.2.3 from 10.128.64.184, on dev ens192
Apr 09 19:03:20 node02 kernel: IPv4: martian source 10.128.2.3 from 10.128.64.184, on dev ens192
Apr 09 19:03:22 node02 kernel: IPv4: martian source 10.128.2.3 from 10.128.64.184, on dev ens192
```

So what is happening is that node02 is dropping the packets because they're claiming to be from 10.128.64.184, which the box thinks is itself. You can set the sysctl param `net.ipv4.conf.ens192.rp_filter=0` to disable this check, but that only solves half the problem. The other half of the problem is that the because the source address is 10.128.64.184, node02 has no idea how to get the return traffic back to node01.

The root cause for this can be seen in these routes (from node01):
```
# ip route show table local | grep 10.128.64.184
local 10.128.64.184 dev kube-dummy-if table local proto kernel scope host src 10.128.64.184 
broadcast 10.128.64.184 dev kube-dummy-if table local proto kernel scope link src 10.128.64.184 
```

The `src` value is what's telling the host to use `10.128.64.184` as the source address. This can be fixed by instead doing something like:
```
localip=$(oc get node $(hostname) -o jsonpath='{.status.addresses[?(@.type=="InternalIP")].address}')
ip route replace local 10.128.64.184 dev kube-dummy-if table local proto kernel scope host src $localip table local
```

&nbsp;

version is 559304f

**Comment by murali-reddy** [comment]
What it means is on the node01, traffic was `10.128.64.184.44828 > 10.128.64.184.443` before hittng the LVS.

Though it's perfectly possible scenario strange I never ran into this issue. I would have tested on various Linux flavours same scenario, `source address selection` never picked up same ip.

**Comment by murali-reddy** [comment]
@phemmer if you get a chance could you please check if fix in latest release `v0.2.0-beta5` this issue.

**Comment by phemmer** [comment]
Yes, the issue does appear to be resolved.

```
# oc get svc -n openshift-web-console
NAME         TYPE           CLUSTER-IP      EXTERNAL-IP                 PORT(S)         AGE
webconsole   LoadBalancer   10.128.67.184   10.128.68.84,10.128.68.84   443:30258/TCP   32m

# ipvsadm -Ln -t 10.128.67.184:443
Prot LocalAddress:Port Scheduler Flags
  -> RemoteAddress:Port           Forward Weight ActiveConn InActConn
TCP  10.128.67.184:443 rr
  -> 10.128.0.3:8443              Masq    1      0          0         
  -> 10.128.2.3:8443              Masq    1      0          0         

# ip route get 10.128.67.184
local 10.128.67.184 dev lo src 172.17.0.2 

# curl -k https://10.128.67.184
<a href="/console/">Found</a>.

{
  "paths": [
    "/healthz",
    "/healthz/ping",
    "/metrics"
  ]
}
# ^ repeated multiple times, no errors.
```

Thanks.

**Comment by debianmaster** [comment]
@phemmer   can you please share your openshift setup instruction for kube-router . i'd like to try
