### ISSUE TITLE
kube-router with all defaults fails to work without promiscuous mode

### ISSUE THREAD

**Issue by zerkms** [cloudnativelabs/kube-router#626]
What I have done:

Installed kubernetes + kube-router on 2 hosts:

```
curl -fsSL https://download.docker.com/linux/ubuntu/gpg | sudo apt-key add -
echo "deb [arch=amd64] https://download.docker.com/linux/ubuntu bionic stable" > /etc/apt/sources.list.d/docker.list
apt update
apt install docker-ce=18.06.1~ce~3-0~ubuntu

curl -s https://packages.cloud.google.com/apt/doc/apt-key.gpg | apt-key add -
echo "deb http://apt.kubernetes.io/ kubernetes-xenial main" > /etc/apt/sources.list.d/kubernetes.list
apt update
apt install -y kubelet kubeadm kubectl

kubeadm init \
    --apiserver-advertise-address=10.50.4.2 \
    --pod-network-cidr=10.244.0.0/16 \
    --service-cidr=10.42.0.0/16 \
```

Hosts are: 10.50.4.2/16 (hq-srv02) - master, 10.50.4.4/16 (hq-srv04) - the only worker node

I then removed kube-proxy and installed kube-router

```
kubectl -n kube-system delete ds kube-proxy
docker run --privileged -v /lib/modules:/lib/modules --net=host k8s.gcr.io/kube-proxy-amd64:v1.10.2 kube-proxy --cleanup

kubectl apply -f https://raw.githubusercontent.com/cloudnativelabs/kube-router/master/daemonset/kubeadm-kuberouter-all-features.yaml
```

And then to check everything works I installed a dashboard:

```
kubectl apply -f https://raw.githubusercontent.com/kubernetes/dashboard/v1.10.1/src/deploy/recommended/kubernetes-dashboard.yaml
```

Now:

```
# kubectl get pods --all-namespaces -o wide
NAMESPACE     NAME                                   READY   STATUS    RESTARTS   AGE     IP           NODE       NOMINATED NODE   READINESS GATES
kube-system   coredns-86c58d9df4-5mgq5               1/1     Running   0          16m     10.244.0.3   hq-srv02   <none>           <none>
kube-system   coredns-86c58d9df4-9x86z               1/1     Running   0          16m     10.244.0.2   hq-srv02   <none>           <none>
kube-system   etcd-hq-srv02                          1/1     Running   0          15m     10.50.4.2    hq-srv02   <none>           <none>
kube-system   kube-apiserver-hq-srv02                1/1     Running   0          15m     10.50.4.2    hq-srv02   <none>           <none>
kube-system   kube-controller-manager-hq-srv02       1/1     Running   0          15m     10.50.4.2    hq-srv02   <none>           <none>
kube-system   kube-router-77msw                      1/1     Running   0          14m     10.50.4.2    hq-srv02   <none>           <none>
kube-system   kube-router-vmpzs                      1/1     Running   0          10m     10.50.4.4    hq-srv04   <none>           <none>
kube-system   kube-scheduler-hq-srv02                1/1     Running   0          15m     10.50.4.2    hq-srv02   <none>           <none>
kube-system   kubernetes-dashboard-57df4db6b-5hwbl   1/1     Running   0          5m37s   10.244.1.3   hq-srv04   <none>           <none>
```

Routing is set up to pass `10.42.0.0/16` through `10.50.4.2` (master)

And now unless I run `tcpdump -i br0 -n icmp` on the master (to switch `br0` to the promiscuous mode), clients cannot reach the pod.

```
# kubectl get svc --all-namespaces
NAMESPACE     NAME                   TYPE        CLUSTER-IP    EXTERNAL-IP   PORT(S)         AGE
default       kubernetes             ClusterIP   10.42.0.1     <none>        443/TCP         18m
kube-system   kube-dns               ClusterIP   10.42.0.10    <none>        53/UDP,53/TCP   18m
kube-system   kubernetes-dashboard   ClusterIP   10.42.3.170   <none>        443/TCP         8m11s
```

`curl -k https://10.42.3.170` - this works fine on both master and worker nodes, but fails from the external clients, unless the master's interface is in promiscuous mode.

The client in the following example requests from `10.50.1.1/16`

Some more details:

```
# ipvsadm -l -n
IP Virtual Server version 1.2.1 (size=4096)
Prot LocalAddress:Port Scheduler Flags
  -> RemoteAddress:Port           Forward Weight ActiveConn InActConn
TCP  10.42.0.1:443 rr
  -> 10.50.4.2:6443               Masq    1      2          0         
TCP  10.42.0.10:53 rr
  -> 10.244.0.2:53                Masq    1      0          0         
  -> 10.244.0.3:53                Masq    1      0          0         
TCP  10.42.3.170:443 rr
  -> 10.244.1.3:8443              Masq    1      1          0         
UDP  10.42.0.10:53 rr
  -> 10.244.0.2:53                Masq    1      0          0         
  -> 10.244.0.3:53                Masq    1      0          0         
```

That's how tcpdump looks on both nodes:

on master
```
02:26:57.093827 IP 10.50.1.1.41936 > 10.42.3.170.443: Flags [S], seq 2260960247, win 29200, options [mss 1460,sackOK,TS val 1605830343 ecr 0,nop,wscale 7], length 0
02:26:57.093916 IP 10.50.4.2.41936 > 10.244.1.3.8443: Flags [S], seq 2260960247, win 29200, options [mss 1460,sackOK,TS val 1605830343 ecr 0,nop,wscale 7], length 0
```

on worker:
```
02:26:57.096598 IP 10.50.4.2.41936 > 10.244.1.3.8443: Flags [S], seq 2260960247, win 29200, options [mss 1460,sackOK,TS val 1605830343 ecr 0,nop,wscale 7], length 0
02:26:57.096728 IP 10.244.1.3.8443 > 10.50.4.2.41936: Flags [S.], seq 3795124646, ack 2260960248, win 28960, options [mss 1460,sackOK,TS val 2688229229 ecr 1605830343,nop,wscale 7], length 0
```

on client (this captured from different request, so timestamp and port don't match, but the rest is the same):

```
15:28:25.904676 IP 10.50.1.1.41982 > 10.42.3.170.https: Flags [S], seq 3342067794, win 29200, options [mss 1460,sackOK,TS val 1605919149 ecr 0,nop,wscale 7], length 0
```

**Comment by zerkms** [comment]
I have found the problem was in my configuration: I was using a bridge.

So it looks like I needed to do something extra in that case. As bridge is not necessary in this scenario I just switched back to using the interface directly and all started working fine.
