### ISSUE TITLE
Connectivity through ipip is broken since 2.3.0

### ISSUE THREAD

**Issue by zerkms** [cloudnativelabs/kube-router#1778]
## What happened?

I haven'd had any chance to make a thorough investigation, but after upgrading from 2.2.2 to 2.3.0 (or 2.4.0) I have found that cluster traffic through ipip tunnel is now broken.

I run kubernetes on aws (non-managed, fully manual with kubeadm).

All 2.1.x and every 2.2.x versions are fine.

Example of working version, traffic capturing from the _requesting_ side (pods: `10.70.64.0/18`, nodes: `10.70.0.0/18`, so in this case prometheus pod 10.70.66.72 connects to kuberouter prometheus metrics endpoint 10.70.3.252.8080)

```
01:05:57.219829 veth5d42dbaa P   IP 10.70.66.72.60898 > 10.70.3.252.8080: Flags [S], seq 3275248777, win 64240, options [mss 1460,sackOK,TS val 3163642536 ecr 0,nop,wscale 7], length 0
01:05:57.219852 kube-bridge In  IP 10.70.66.72.60898 > 10.70.3.252.8080: Flags [S], seq 3275248777, win 64240, options [mss 1460,sackOK,TS val 3163642536 ecr 0,nop,wscale 7], length 0
01:05:57.219896 tun-15bfd89866c Out IP 10.70.66.72.60898 > 10.70.3.252.8080: Flags [S], seq 3275248777, win 64240, options [mss 1460,sackOK,TS val 3163642536 ecr 0,nop,wscale 7], length 0
01:05:57.220612 tun-15bfd89866c In  IP 10.70.3.252.8080 > 10.70.66.72.60898: Flags [S.], seq 2430033775, ack 3275248778, win 64260, options [mss 1440,sackOK,TS val 1764607748 ecr 3163642536,nop,wscale 7], length 0
01:05:57.220655 kube-bridge Out IP 10.70.3.252.8080 > 10.70.66.72.60898: Flags [S.], seq 2430033775, ack 3275248778, win 64260, options [mss 1440,sackOK,TS val 1764607748 ecr 3163642536,nop,wscale 7], length 0
01:05:57.220661 veth5d42dbaa Out IP 10.70.3.252.8080 > 10.70.66.72.60898: Flags [S.], seq 2430033775, ack 3275248778, win 64260, options [mss 1440,sackOK,TS val 1764607748 ecr 3163642536,nop,wscale 7], length 0
```

And now example of broken communication (actors are the same - prometheus<->kube router metrics endpoint):

```
00:59:34.629933 veth31f515fd P   IP 10.70.66.70.36128 > 10.70.3.252.8080: Flags [S], seq 3204011955, win 64240, options [mss 1460,sackOK,TS val 3575682568 ecr 0,nop,wscale 7], length 0
00:59:34.629954 kube-bridge In  IP 10.70.66.70.36128 > 10.70.3.252.8080: Flags [S], seq 3204011955, win 64240, options [mss 1460,sackOK,TS val 3575682568 ecr 0,nop,wscale 7], length 0
00:59:34.629998 tun-15bfd89866c Out IP 10.70.1.119.44446 > 10.70.3.252.8080: Flags [S], seq 3204011955, win 64240, options [mss 1460,sackOK,TS val 3575682568 ecr 0,nop,wscale 7], length 0
00:59:35.651409 veth31f515fd P   IP 10.70.66.70.36128 > 10.70.3.252.8080: Flags [S], seq 3204011955, win 64240, options [mss 1460,sackOK,TS val 3575683590 ecr 0,nop,wscale 7], length 0
00:59:35.651423 kube-bridge In  IP 10.70.66.70.36128 > 10.70.3.252.8080: Flags [S], seq 3204011955, win 64240, options [mss 1460,sackOK,TS val 3575683590 ecr 0,nop,wscale 7], length 0
00:59:35.651457 tun-15bfd89866c Out IP 10.70.1.119.44446 > 10.70.3.252.8080: Flags [S], seq 3204011955, win 64240, options [mss 1460,sackOK,TS val 3575683590 ecr 0,nop,wscale 7], length 0
00:59:36.675398 veth31f515fd P   IP 10.70.66.70.36128 > 10.70.3.252.8080: Flags [S], seq 3204011955, win 64240, options [mss 1460,sackOK,TS val 3575684614 ecr 0,nop,wscale 7], length 0
00:59:36.675404 kube-bridge In  IP 10.70.66.70.36128 > 10.70.3.252.8080: Flags [S], seq 3204011955, win 64240, options [mss 1460,sackOK,TS val 3575684614 ecr 0,nop,wscale 7], length 0
00:59:36.675424 tun-15bfd89866c Out IP 10.70.1.119.44446 > 10.70.3.252.8080: Flags [S], seq 3204011955, win 64240, options [mss 1460,sackOK,TS val 3575684614 ecr 0,nop,wscale 7], length 0
```

See that SYN packet is sent, and no response received. And also what is weird is that see that when the packet is about to be sent through the ipip tunnel - it changes (NAT?) the src ip:port to the node: prometheus `10.70.66.70.36128`, but step 3: `tun-15bfd89866c Out IP 10.70.1.119.44446` where `10.70.1.119.` is the ip of the node where prometheus is running.

As expected on the other side the packet is discarded because it does not pass the return-path check.

## How can we reproduce the behavior you experienced?

1. Step 1
2. Step 2
3. Step 3
4. Step 4

## Screenshots / Architecture Diagrams / Network Topologies

If applicable, add those here to help explain your problem.

## System Information (please complete the following information)

- Kube-Router Version (`kube-router --version`): 2.3.0, 2.4.0
- Kube-Router Parameters: `--run-router=true --run-firewall=true --run-service-proxy=true --bgp-graceful-restart=true --kubeconfig=/var/lib/kube-router/kubeconfig --hairpin-mode=true --metrics-port=8080`
- Kubernetes Version (`kubectl version`) : [e.g. 1.18.3] 1.30.6
- Cloud Type: [e.g. AWS, GCP, Azure, on premise] aws deployed with kubeadm
- Kubernetes Deployment Type: [e.g. EKS, GKE, Kops, Kubeadm, etc.] kubeadm
- Kube-Router Deployment Type: [e.g. DaemonSet, System Service] daemonset
- Cluster Size: [e.g. 200 Nodes] ~10

## Logs, other output, metrics

No anomalies in logs.

Please provide logs, other kind of output or observed metrics here.

**Comment by aauren** [comment]
Thanks for reporting! This indeed appears to be an accidental regression.

Can you try the build in #1779 and see if that fixes the issue for you?

**Comment by zerkms** [comment]
@aauren if you push it to the docker-hub - I could yep

**Comment by aauren** [comment]
It gets built as part of the PR automation: https://github.com/cloudnativelabs/kube-router/actions/runs/12249121296/job/34169887344?pr=1779

Looks like it is called: cloudnativelabs/kube-router-git:PR-1779

https://hub.docker.com/layers/cloudnativelabs/kube-router-git/PR-1779/images/sha256-62e25b9fd11d15d26e14fbee7a527f6d364f450e2f2973f6695ee870233d9841?context=explore

**Comment by zerkms** [comment]
@aauren yep, can confirm `cloudnativelabs/kube-router-git:PR-1779` fixes it!
